start	end	text
1157440	1159920	We're all going to have things we're going to want to hit.
1159920	1166000	But not everything has to be, just like you said, 24-7, 365.
1166640	1171920	Because at some point, it's going to stack so much that you as a leader are realizing you're
1171920	1173440	probably not being very efficient.
1173440	1178480	Your employees are probably not working super efficiently, not working well together.
1178480	1182000	And they're probably, you've caused a lot of bad stress, distress in their life.
1182000	1186320	That's leading to things like anxiety, depression, and then starts to lead to physical ailments.
1186320	1192160	Because we know there's a linkage between, you know, your mental health and your physical health.
1192160	1196080	And so that becomes a very vicious cycle, especially in the workplace.
1196080	1199040	And that leads to a lot of unproductivity.
1199040	1204560	What I've found with the two is you really have to find that right balance and understand there
1204560	1206960	will be, and just talk about it.
1206960	1207680	There's a push.
1207680	1208800	We're all going to make a push.
1209440	1214400	We did it recently as a company at Calm around the elections.
1214960	1220000	And we treated the elections like our Super Bowl moment because we knew, and we saw the data,
1220000	1225760	that people's stress was rising every day as that day, November 5th, got closer and closer.
1225760	1226800	We saw it in the App Store.
1226800	1227760	We saw it in comments.
1227760	1229520	We saw it on social.
1229520	1235200	So we really came together as a company to do different types of things around that.
1235200	1238160	Take a breath, 30 seconds or 15 seconds of silence.
1239280	1244240	We showed animals from the San Diego Zoo on Instagram.
1244240	1248800	And we got so many people commenting that day that said, hey, thank you for the silence.
1249520	1255120	Thank you for my 15 seconds in this world where so many things are happening.
1255120	1258800	Now, people were dialing in from work because they were stressed at work.
1258800	1260480	Stress doesn't just mean it's at home.
1260480	1263280	It was like people were like during the elections coming in from work.
1263280	1267920	And so we wanted to give them a little bit so they had a release so they could be more productive.
1268480	1274080	So there's a lot of things around stuff that I look at for good stress and bad stress and recognize
1274080	1278800	there's always going to be a push-pull, but that's the part where you can't do it alone.
1278800	1279760	You got to have a good team.
1279760	1280720	You got to talk about it.
1280720	1286480	You do this so well and make sure that becomes part of your fabric, your culture, your DNA.
1287280	1290800	And I think it's shifting, but it's slow.
1290800	1291440	Yeah.
1291440	1294480	I think the conversation around mental health in everyday life,
1295600	1298720	it's the most approachable it's ever been, right?
1298720	1301680	I talk about things with my own kids today around mental health.
1302320	1306560	When I was a child coming, you know, I'd be curious, like for you, like immigrant family,
1307120	1310080	we didn't talk about our mental health in my household, right?
1310080	1314000	We talked more about powering through things and I can talk about that later,
1314000	1315440	but we didn't really talk about it.
1315440	1319680	My kids talk about it. They may overuse it at times, not use it the right way.
1320480	1322640	It's okay. They're having the conversation.
1322640	1325360	Their friends are having the conversation. I think that's great.
1326320	1330480	But when you go to the workplace, it kind of stops, you know?
1330480	1333760	And I go to so many places and I'm like, do you talk about your mental health at work?
1333760	1334400	And they're like, no.
1335120	1337280	And I'm like, well, let's change that dialogue.
1337840	1341120	Let's make it as approachable as it is in everyday life.
1341120	1344560	And how do we start to do that? Let's give you the tools and we'll start at the top.
1344560	1346160	Yeah, you're so right. You're so right.
1346160	1352080	What you're painting a picture of for me is that I look at the good stress being
1352080	1354640	when we all know what challenge we're up against.
1355360	1358800	We know what the goal is and everyone feels supported.
1359360	1363680	And I think what often happens is people don't know what the goal is
1363680	1365680	because you're not helping them do that.
1365680	1368720	They only see the challenge and they don't feel supported.
1368720	1369440	That's right.
1369440	1374080	So now they don't know where they're going and they feel if they fall flat on their face,
1374080	1375360	they have nothing to catch them.
1375360	1376160	That's right.
1376160	1380640	As a leader, the goal is to provide the goal and the support.
1380640	1382720	And then the person can focus on the challenge.
1382720	1385120	Yeah. And be transparent in that journey.
1385120	1389600	You know, I speak to many CEOs in the Valley and over the world.
1389600	1394160	And, you know, a lot of times I'll ask them, how do you prioritize things with your employees?
1394160	1395760	How transparent are you?
1395760	1398320	And I'll tell you, many of them are not that transparent.
1398320	1400240	Or they'll be like, these are the most important things.
1401200	1404240	And then they'll add five more and then five more.
1404240	1405600	Right. And I'll be like, oh, okay.
1406320	1407520	What did you take away?
1408160	1409360	And they're like, what are you talking about?
1409360	1411680	I mean, what did you take away?
1412480	1414880	And they're like, nothing.
1415440	1418400	And I'm like, well, how do you think that's affecting your employees?
1419040	1421120	And they're like, I never really thought about that.
1421680	1426800	So I've just compounded and stacked the problem as a leader.
1426800	1433600	And you didn't take anything away and it cascades down like a megaphone.
1434240	1439040	Think about what that employee is going through and walk in their shoes for a minute.
1439760	1445040	You know, we at the top have the luxury of having more control over our schedules.
1446080	1448800	But that person may not have as much control over their schedule.
1448800	1450480	They're just ticking through things.
1450480	1450960	Yeah.
1450960	1456240	And if you just keep adding and not taking certain things away and saying, this is important.
1456240	1457360	This isn't important.
1457360	1458400	Here's how I think about it.
1458400	1459760	Here's how I'm being transparent.
1460480	1462240	You're adding more stress to your company.
1462240	1465200	You know, leaders struggle with how to be vulnerable.
1465200	1466560	Is it going to be used against me?
1466560	1467040	Yeah.
1467040	1469360	Is someone going to write about it and say I'm too weak?
1469360	1472480	Is the board going to think I'm weak as a leader?
1472480	1476800	That's ultimately also a fail of corporate stewardship.
1476800	1479520	Because they have to also look after your mental health.
1479520	1481120	At Calm, I love this.
1481120	1486400	When I first got introduced to Calm and started taking calls with the teams
1486400	1490640	and I took my role of chief purpose officer, I got integrated into the culture.
1491520	1496880	I loved the little things and the focus on the little things at meetings at Calm,
1496880	1498880	whether they're on Zoom, in person.
1498880	1504240	I want to hear about these smaller things that are happening on a daily basis.
1504240	1507840	Because I think often companies think they need to put out a thing that says,
1507840	1511360	we're focusing on company mental health and they're doing these big things.
1511360	1516320	But Calm internally, let alone the work they do with other companies and workplaces,
1516320	1523040	but Calm internally had some really nice cultural things that I noticed from the outside in
1523040	1524720	as I was being integrated.
1524720	1528640	Walk us through some of those daily things that you think create the rituals and practices
1528880	1529840	that help people.
1529840	1535360	It was interesting for me, my first day at Calm, I walk in and they're Michael and Alex,
1535360	1536880	who you know well, the founders, right?
1536880	1537520	Yeah, I love them.
1537520	1540720	And they love you and they talk about you all the time and how you all first met.
1541600	1546960	And they introduced me to the company, warm welcome, so inviting.
1547600	1551040	And they started the whole all hands off with a meditation.
1552640	1553920	And I wasn't really used to that.
1554800	1559920	You know, and I was I was kind of sitting there and I kind of noticed everyone.
1559920	1562160	And normally we listen to someone like yourself.
1562160	1566000	We'll turn you on or we'll turn one of our other kind of narrators on.
1566000	1566720	They do great.
1567280	1569520	And everyone just kind of sat there in the moment.
1569520	1572560	And whether it was sometimes it's, you know, really quick, 30 seconds,
1572560	1574960	sometimes it's five, six minutes, something three minutes.
1575760	1580160	And they listened and it was and I kind of was peeking at times looking.
1580160	1584000	I'm like, is everyone kind of closing their eyes, you know, around here, you know, looking there.
1584000	1586480	And they were just in the moment.
1586480	1589440	It was a moment for me that showed me how much they cared.
1590160	1591840	And I was like, wow, this company cares.
1592560	1593840	This isn't forced.
1593840	1594960	You don't have to be here.
1594960	1596480	You don't have to do this.
1596480	1599120	And they were there and they were present and they were in the moment.
1599920	1600960	So that's like some of this.
1600960	1603680	That was one of the ways I knew this company was going to be different.
1604560	1610880	And then I watched as the company did things around gratitude, where we end every all hands
1610880	1611680	with gratitude.
1612240	1617680	We read things that have come into us and it's a reminder of the impact we're having.
1618400	1624720	And I think that's why sometimes I'm so stressed because I feel this weight of responsibility
1625280	1628160	where every second of every day someone is using the product.
1628880	1635280	And I just feel like if we're not answering them or not helping them in the moment,
1635280	1636960	someone's not getting something that they need.
1637920	1641040	And I feel that stress and I feel the response.
1641040	1642240	It's really responsibility.
1642240	1642560	Yeah.
1642560	1644880	And I talk about that with the employees.
1645440	1647360	And I think it's really important to talk about that.
1647360	1649120	So we do the gratitude piece at the end.
1649680	1655120	We have zoom free days, you know, where I talk to employees about,
1655120	1660400	hey, if you're in a moment where you find yourself in five zooms, take a beat.
1660960	1662080	You don't need to do that.
1662080	1665360	And if there's meetings that don't make sense, just like you did tonight, which was great.
1666080	1667840	Just say, no, it's okay.
1667840	1669360	You know, we'll figure it out.
1670000	1670880	And I do that too.
1670880	1676000	And I try to be a lot more purposeful now because it helps me then be more present
1676000	1677600	in the meetings that I need to be in.
1677600	1678000	Yeah.
1678000	1678720	Right.
1678720	1682400	And rather than saying, it's not the quantity of meetings that I'm in,
1682400	1684720	it's those quality of meeting moments that I'm in.
1685280	1692320	And I think people sometimes like misinterpret like quantity for productivity versus like value.
1692960	1698160	And I'm much more like, okay, I'm going to do, I'm going to focus on quality.
1698160	1699120	And it may mean less.
1699760	1702240	And that doesn't have to sacrifice my impact.
1702240	1704720	I was going to ask you, how does it impact productivity?
1705440	1709280	And I do think that we've convinced ourselves that if I'm doing more,
1709280	1713440	if there's more on my schedule, if I'm jumping around, we've created
1714240	1719520	our definition of value to be around busyness, right?
1719520	1720320	Yes.
1720320	1724800	And we all feel we're more important, valuable, and it's subconscious.
1724800	1728720	Again, you just think, oh yeah, if I've got a lot to do, then I must be doing something.
1728720	1729280	Yeah.
1729280	1731360	How do we start to shift that conversation?
1731360	1732800	What have you learned about that?
1732800	1736240	I know you interviewed some amazing people as well, as you were saying inside the book.
1736240	1740080	What did you learn about how we can reframe what we believe makes us valuable?
1740080	1740880	Yeah, yeah.
1740880	1747360	So I had, so two people in particular, so John Scully, for example, the former CEO of Apple,
1748320	1752000	he talked about how in the book he was chief listening officer.
1752640	1754160	And I was like, really?
1754160	1754880	And he's like, yeah.
1755600	1758800	Like Steve asked that we make our own business cards.
1759760	1761680	And I wrote chief listening officer.
1762320	1765680	And I sat there and I was like, wow, that's, that was great.
1766400	1767600	You listen.
1767600	1772000	And so, because so often, you know, you just start talking.
1772720	1779760	And he's like, no, I became a lot more purposeful if I just listened first, said probably less.
1780720	1784960	But that impact was greater because I heard what was happening and I thought that was great.
1785840	1789920	I had Jack Rowe, who's a former CEO of Aetna in the book, he came over and he said,
1791200	1793280	sometimes you have to put yourself into neutral.
1793920	1797760	And he's like, and you have to give yourself space because you can't run at 100 miles an hour.
1798320	1803280	And if you don't give yourself a little bit of a break, no matter what position you're in,
1804240	1809680	you're going to find yourself upside down and you're not going to figure out how to turn back up.
1810640	1816720	And I appreciated those conversations with them because they're a little bit more old school in
1816720	1817360	their approach.
1818400	1821200	They think we're a little bit more in the middle now.
1821200	1824240	And then there's a younger generation, right, that's coming up with things about things completely
1824240	1829680	different. It's been such a privilege to be able to kind of talk to so many different people
1830400	1834400	who are in that continuum to kind of hear how they're managing it, right?
1835040	1837920	Even like how you think about things today and how you manage all that, right?
1837920	1841920	It just must be a lot coming at you today from many different angles when they're like,
1841920	1843040	Jay, what do you do?
1843040	1848800	Yeah, yeah. And I think for me, it is the old cliche, but it's so true.
1848800	1850640	Like you are only as good as your team.
1851360	1855040	And I do think being a leader means taking care of your team.
1855040	1856000	That's right.
1856000	1860480	In one sense, I feel like that's all a leader actually has to do is be the coach,
1860480	1865680	therapist, support system or provide and bring those things in for the team.
1865680	1867600	And you almost become a coach.
1867600	1868000	Right.
1868000	1869520	And yes, you're being strategic.
1869520	1870880	Yes, you're being a visionary.
1871440	1876000	But a lot of it is just loving people and supporting people.
1876000	1879760	I find at least, I find like that's what most of my time is taken up.
1879760	1880480	100%.
1880480	1883280	Doing because everyone has their emotions.
1883280	1885600	And as long as you have smart people that you're working with,
1886400	1890000	then those people are the people that investing in them as humans.
1890000	1890480	Yeah.
1890480	1892640	Is allowing them to do what you trust them to do.
1892640	1893200	That's right.
1893200	1897760	But the thing that's holding them back is usually something emotional or mental.
1897760	1900000	It's rarely professional that people have challenges.
1900000	1902880	And I find it's something they're going through in their personal life.
1903440	1905120	It's a mental block that they have.
1905120	1905920	Yeah.
1905920	1909280	And if that doesn't get healed and accessed in the workplace,
1910000	1911840	that's going to be the spanner in the works.
1911840	1915680	Like that's going to be the thing that bottlenecks the process,
1915680	1918640	creates inefficiency, creates a lack of trust.
1918640	1919120	That's right.
1919120	1920800	That's the kind of stuff that gets in the way.
1920800	1921200	Yeah.
1921200	1923920	And a lot of times too, when you talk to people,
1923920	1926640	they have no idea what's happening outside the workplace.
1926640	1927360	Mm-hmm.
1927360	1931760	You know, but so much that happens outside the workplace affects the workplace.
1932640	1937200	It's really important for companies too, to have mental health support tools for employees.
1937200	1940240	So when they need things, people to talk to, you know, applications,
1940240	1943360	whether they're calm or others, therapy, if they need it,
1944080	1948000	if they just make those available and known, that's another step in the process.
1948000	1948240	Yeah.
1948240	1950560	So that's why I always tell people, it's not just one thing.
1950560	1953120	It's kind of like a number of things you have to put together,
1953120	1955920	because people may take bits and pieces of each to make it their own.
1956720	1959440	But it kind of shows them when they need it, it's there.
1959440	1959760	Yeah.
1959760	1962480	And a lot of times people will go look for things on their own.
1962480	1965520	You know, they'll search and they'll see if you got tools and what companies.
1966400	1969200	And I do find that you sometimes will lose good people
1969200	1971520	because you're not supporting them in their journey.
1971520	1971920	Yeah.
1971920	1976720	And so the more you could be there for them and they know that,
1977360	1981760	they become some of your most loyal, most productive,
1981760	1985280	most culture bearing, you know, carrying the flag employees.
1985280	1985600	Yeah.
1985600	1986800	And you didn't have to tell them to do it.
1986800	1988400	They just kind of did it on their own.
1988400	1989120	Absolutely.
1989120	1991680	And I feel like those often are the best ones.
1992480	1995040	And I, and we have a lot of those.
1995840	1999120	And I'm very, and I just feel very privileged that we have so many folks like that,
1999840	2002480	that they just care deeply and it's personal for them.
2003760	2006400	My previous company I had started was a caregiving company.
2007360	2012080	And one thing I noticed in that company was that so many people that were caring for
2012080	2015040	others were suffering, right?
2015040	2020560	They, and then they had to go to work and people had no idea that they were doing like five jobs,
2021360	2023920	caregiver, they were worrying about their finances.
2023920	2026000	They were trying to figure out how they help people.
2026000	2029600	And then they had to go to work and, and they had a litany of things they had to go do.
2029600	2033120	And most people have no idea all these things are going on in their people's lives,
2033120	2033280	right?
2033280	2034800	Because sometimes we just don't ask the question.
2035360	2039280	And because we're so busy ourselves, or sometimes we don't want to ask the question
2039280	2041680	because we're so busy ourselves, we can't take anything else off.
2042320	2049040	But I just feel that if we are just more aware and we create space for employees and we listen to
2049040	2052800	what they have to say, flexible work schedules, what are they asking for?
2052800	2055200	That's why I constantly poll our employees as well.
2055840	2056800	What do you value?
2057600	2058880	And they'll tell us.
2059600	2063120	And then if we have stuff that they don't want, we put it away.
2063120	2065920	I sometimes like, oh, all my employees want this gym membership.
2066480	2067520	And then nobody uses it.
2069440	2071680	And, and they're like, just ask.
2071680	2072240	Yeah.
2072240	2077120	And I'm like, now I just ask, let's have our team go out and say, here are the top 10 things.
2077120	2077840	What do you want?
2077840	2078560	Yeah.
2078560	2081520	And then we'll take away a couple of things that they don't use, you know,
2081520	2084240	and we'll try to ask that almost every year.
2084240	2084800	Totally.
2084800	2086560	I, I, I couldn't agree more.
2086560	2088720	We, I love gift giving.
2088720	2090000	It's one of my love languages.
2090000	2093600	And you were so kind to bring me a gift today, which was very thoughtful
2093600	2097760	and very useful and both of which I will use.
2097760	2101120	And the reason I'm saying that is I love giving gifts too.
2101840	2105280	And so, you know, over the years, when it comes around the holidays,
2105280	2106960	I love getting gifts for my team.
2107760	2111440	And for a long time, I'd always be guessing like what everyone wanted.
2112160	2116000	And you assume that something's cool or trending or whatever it may be.
2116000	2119440	And then you start to realize what you just said, people didn't really want that.
2119440	2120080	Yeah.
2120080	2122320	And then at one point we were like, okay, well then we won't give gifts.
2122320	2124720	We'll just, you know, thank people and whatever else it was.
2124720	2127120	But then we were like, no, but people like, people like it.
2127120	2127280	Yeah.
2127280	2128480	Everyone enjoys it.
2128480	2129280	And so, it's so funny.
2129280	2131120	We've started polling over the last few years.
2131120	2132960	Like what kind of gift would everyone like?
2132960	2135600	And the number one answer this year was infrared masks.
2135600	2137040	Like, so what are you calling out here?
2137040	2137760	Yeah.
2137760	2139120	That was the number one request.
2139120	2139920	Yeah, that's great.
2139920	2140480	The red light.
2140480	2141040	Yeah.
2141040	2142160	So that was the number one request.
2142160	2143120	And we're like, oh, easy.
2143120	2144800	Now we know what everyone wants.
2145360	2149760	So we're going to get that because it's easier rather than us guessing.
2149760	2150160	Yeah.
2150160	2155280	And I agree that I do think people inside of organizations today want mental health tools.
2155280	2155440	That's right.
2155440	2157440	They want meditation practices.
2157440	2161680	They want mindfulness opportunities and tools and apps and everything else.
2161680	2164000	I do believe there is a big demand for that.
2164480	2166400	And I think it's only growing.
2166400	2166960	Oh, yeah.
2166960	2170400	Because people are feeling that if you don't have that,
2170960	2173200	you can't have that conversation in the workplace.
2173200	2173600	That's right.
2173600	2177280	I think this is the part that I want companies and leaders to understand.
2177280	2182000	If you're not providing tools to support people with their mental health,
2182800	2186240	they don't have a vehicle to talk about it at work.
2186240	2186720	That's right.
2186720	2189760	If it's available to everyone and they see it come out in the newsletter
2189760	2193200	and the team's available and everyone knows about it, they can say,
2193200	2194800	oh, yeah, did you see we're using Calm now?
2194800	2196720	And, you know, I've been doing this one.
2196720	2197840	And which one have you been doing?
2197840	2202320	And now it allows for connection and conversation and community,
2202320	2205280	as opposed to without it, someone may just never talk about the fact
2205280	2207200	that they've been struggling to sleep for seven days.
2207200	2207920	A hundred percent.
2207920	2208320	Right?
2208320	2208800	A hundred percent.
2208800	2212080	And I find that, too, amongst the younger generation,
2212720	2213920	they just expect these things.
2213920	2214400	Yeah.
2214400	2216160	You know, and they're asking for them.
2216160	2218240	And they'll give up other things along the way.
2218240	2218640	Yeah.
2218640	2220800	And so, and they're very vocal around it.
2221440	2223760	And we've seen it now in all industries.
2224320	2226000	You know, we've seen it happen in banking,
2226000	2228080	where people feel like, hey, you're not listening.
2228720	2233200	And it takes a moment where they have to go to the press almost.
2233200	2233600	Right?
2233600	2235200	It shouldn't have to ever get there.
2235200	2235760	Yeah.
2235760	2239920	If they were listening to those kids and listening to your employees,
2240480	2242560	then you've got a continuous feedback loop.
2242560	2243120	Yeah.
2243120	2244960	More companies, the baseline will be,
2244960	2246960	you have to have these services going forward.
2247680	2251680	And, and I think over time, then that will open up a dialogue.
2252400	2254400	And I also think with CEOs today, I'll tell you,
2254400	2256000	because it starts so much at the top.
2256960	2259120	If you start to have some of these conversations and say,
2259120	2260160	here's how I think about it.
2260160	2262000	Here's how you're being vulnerable.
2262000	2263920	That too opens up a different conversation.
2264640	2267440	And then that can just kind of percolate within the company.
2268080	2271760	And, and then I think the whole thing starts to move faster.
2272320	2272800	Right?
2272800	2275920	And then we can start to get more into a conversation of like,
2275920	2278880	okay, now how do we get you the right care at the right time
2278880	2280480	when you need it, however you need it?
2281280	2285360	Because so much of the conversation we're having right now is pretty basic in my mind.
2286000	2289120	And we just need to get farther along in the conversation.
2289120	2289440	Yeah.
